{
  "$schema": "https://json-schema.org/draft/2020-12/schema",
  "$id": "https://github.com/allsmog/vuln-scout/blob/main/vuln-scout/references/findings.schema.json",
  "title": "VulnScout Findings Artifact",
  "type": "object",
  "required": [
    "schema_version",
    "scan_id",
    "project_path",
    "completed_at",
    "source_tool",
    "summary",
    "findings"
  ],
  "properties": {
    "schema_version": {
      "type": "string",
      "enum": ["1.0.0", "1.1.0", "1.2.0"]
    },
    "scan_id": {
      "type": "string"
    },
    "project_path": {
      "type": "string"
    },
    "completed_at": {
      "type": "string"
    },
    "source_tool": {
      "type": "string"
    },
    "scan_profile": {
      "type": "string",
      "enum": ["quick", "deep", "audit"],
      "description": "Scanner profile used to produce this artifact."
    },
    "coverage": {
      "type": "object"
    },
    "verification": {
      "type": "object"
    },
    "tool_status": {
      "type": "object",
      "description": "Requested scanner tool status for this scan.",
      "properties": {
        "requested": {
          "type": "array",
          "items": { "type": "string" }
        },
        "available": {
          "type": "array",
          "items": { "type": "string" }
        },
        "unavailable": {
          "type": "array",
          "items": { "type": "string" }
        },
        "succeeded": {
          "type": "array",
          "items": { "type": "string" }
        },
        "failed": {
          "type": "array",
          "items": { "type": "string" }
        },
        "by_tool": {
          "type": "object",
          "description": "Detailed analyzer status keyed by requested tool name.",
          "additionalProperties": {
            "type": "object",
            "properties": {
              "tool": { "type": "string" },
              "state": {
                "type": "string",
                "enum": ["unavailable", "failed", "partially_skipped", "timed_out", "succeeded", "skipped"]
              },
              "findings": { "type": "integer", "minimum": 0 },
              "reason": { "type": "string" },
              "languages": { "type": "object" }
            }
          }
        }
      }
    },
    "summary": {
      "type": "object",
      "required": [
        "total_findings",
        "total_hotspots",
        "critical",
        "high",
        "medium",
        "low",
        "info"
      ],
      "properties": {
        "total_findings": {
          "type": "integer",
          "minimum": 0
        },
        "total_hotspots": {
          "type": "integer",
          "minimum": 0
        },
        "critical": {
          "type": "integer",
          "minimum": 0
        },
        "high": {
          "type": "integer",
          "minimum": 0
        },
        "medium": {
          "type": "integer",
          "minimum": 0
        },
        "low": {
          "type": "integer",
          "minimum": 0
        },
        "info": {
          "type": "integer",
          "minimum": 0
        }
      }
    },
    "findings": {
      "type": "array",
      "items": {
        "type": "object",
        "required": [
          "id",
          "stable_key",
          "kind",
          "severity",
          "type",
          "title",
          "file",
          "line",
          "verdict",
          "confidence",
          "source_tool",
          "message",
          "evidence"
        ],
        "properties": {
          "id": {
            "type": "string"
          },
          "stable_key": {
            "type": "string"
          },
          "kind": {
            "type": "string",
            "enum": [
              "finding",
              "hotspot"
            ]
          },
          "severity": {
            "type": "string",
            "enum": [
              "critical",
              "high",
              "medium",
              "low",
              "info"
            ]
          },
          "type": {
            "type": "string"
          },
          "title": {
            "type": "string"
          },
          "file": {
            "type": "string"
          },
          "line": {
            "type": "integer",
            "minimum": 0
          },
          "rule_id": {
            "type": "string"
          },
          "cwe": {
            "type": "string"
          },
          "verdict": {
            "type": "string",
            "enum": [
              "verified",
              "false_positive",
              "needs_review",
              "unverified",
              "na_cpg"
            ]
          },
          "confidence": {
            "type": "string",
            "enum": [
              "verified",
              "high",
              "medium",
              "low"
            ]
          },
          "source_tool": {
            "type": "string"
          },
          "message": {
            "type": "string"
          },
          "remediation": {
            "type": "string"
          },
          "in_diff": {
            "type": "boolean"
          },
          "dynamic_verified": {
            "type": "boolean"
          },
          "verification_level": {
            "type": "integer",
            "minimum": 0,
            "maximum": 5,
            "description": "Graduated verification: L0=pattern, L1=dataflow, L2=semantic, L3=PoC, L4=executed, L5=formal"
          },
          "suppressed": {
            "type": "boolean"
          },
          "suppression_reason": {
            "type": "string"
          },
          "cvss_vector": {
            "type": "string",
            "description": "CVSS 3.1 vector string",
            "pattern": "^CVSS:3\\.1/"
          },
          "cvss_score": {
            "type": "number",
            "description": "CVSS 3.1 base score (0.0-10.0)",
            "minimum": 0.0,
            "maximum": 10.0
          },
          "evidence": {
            "type": "array",
            "minItems": 1,
            "items": {
              "type": "object",
              "required": [
                "type",
                "label",
                "path",
                "line",
                "excerpt"
              ],
              "properties": {
                "type": {
                  "type": "string"
                },
                "label": {
                  "type": "string"
                },
                "path": {
                  "type": "string"
                },
                "line": {
                  "type": "integer",
                  "minimum": 0
                },
                "excerpt": {
                  "type": "string"
                },
                "role": {
                  "type": "string",
                  "enum": ["source", "hop", "sink", "sanitizer", "control"],
                  "description": "Role of this evidence item in the data flow (v1.1.0+)"
                },
                "order": {
                  "type": "integer",
                  "minimum": 0,
                  "description": "Position in the data flow sequence (v1.1.0+)"
                }
              }
            }
          },
          "fp_indicator": {
            "type": "string",
            "description": "Reason this finding was demoted by semantic FP check"
          },
          "claude_analysis": {
            "type": "object",
            "description": "Semantic analysis result from Claude reasoning engine",
            "properties": {
              "verdict": { "type": "string" },
              "confidence": { "type": "string" },
              "reasoning": { "type": "string" },
              "source_description": { "type": "string" },
              "sink_description": { "type": "string" },
              "sanitization_present": { "type": ["boolean", "null"] },
              "sanitization_effective": { "type": ["boolean", "null"] },
              "exploitable": { "type": ["boolean", "null"] }
            }
          },
          "trust_metadata": {
            "type": "object",
            "description": "Trust-model signals introduced in schema v1.2.0",
            "properties": {
              "provenance": {
                "type": "object",
                "required": ["origin"],
                "properties": {
                  "origin": {
                    "type": "string",
                    "enum": ["deterministic_tool", "llm_analysis", "dynamic_verified", "human_review", "mixed"]
                  },
                  "tool": { "type": "string" },
                  "contributors": {
                    "type": "array",
                    "items": {
                      "type": "string",
                      "enum": ["deterministic_tool", "llm_analysis", "dynamic_verified", "human_review"]
                    }
                  }
                }
              },
              "exploitability_status": {
                "type": "string",
                "enum": ["confirmed", "plausible", "blocked_by_control", "requires_auth", "unreachable", "unknown"]
              },
              "false_positive_risk": {
                "type": "object",
                "required": ["level"],
                "properties": {
                  "level": {
                    "type": "string",
                    "enum": ["low", "medium", "high", "unknown"]
                  },
                  "reason": { "type": "string" }
                }
              },
              "confidence_reason": {
                "type": "string",
                "maxLength": 280
              },
              "inferred_from_legacy_artifact": {
                "type": "boolean",
                "description": "True when v1.2.0 trust metadata was inferred during migration from an older artifact."
              }
            }
          },
          "chain_id": {
            "type": "string",
            "description": "Groups this finding into an attack chain (v1.1.0+)"
          },
          "chain_role": {
            "type": "string",
            "enum": ["entry", "pivot", "sink"],
            "description": "Role of this finding within its attack chain (v1.1.0+)"
          }
        }
      }
    },
    "entry_points": {
      "type": "array",
      "description": "Discovered HTTP entry points (attack surface map)",
      "items": {
        "type": "object",
        "properties": {
          "method": { "type": "string" },
          "path": { "type": "string" },
          "file": { "type": "string" },
          "line": { "type": "integer" },
          "framework": { "type": "string" },
          "handler": { "type": "string" },
          "has_auth": { "type": "boolean" },
          "auth_detail": { "type": "string" }
        }
      }
    },
    "chains": {
      "type": "array",
      "description": "Attack chains linking multiple findings (v1.1.0+)",
      "items": {
        "type": "object",
        "required": ["id", "name", "finding_ids"],
        "properties": {
          "id": { "type": "string" },
          "name": { "type": "string" },
          "impact": { "type": "string" },
          "finding_ids": {
            "type": "array",
            "items": { "type": "string" }
          },
          "flow_description": { "type": "string" }
        }
      }
    }
  }
}
