{
  "schema_version": "1.2.0",
  "scan_id": "fixture-scan-v1_2_0",
  "project_path": "/tmp/vuln-scout-fixtures",
  "completed_at": "2026-05-19T00:00:00Z",
  "source_tool": "multi",
  "scan_profile": "audit",
  "summary": {
    "total_findings": 12,
    "total_hotspots": 2,
    "critical": 2,
    "high": 4,
    "medium": 4,
    "low": 1,
    "info": 1
  },
  "coverage": {
    "files_scanned": 22,
    "files_skipped": 1,
    "lines_scanned": 1480,
    "ruleset": "fixtures-v1_2_0"
  },
  "verification": {
    "verified": 5,
    "false_positive": 1,
    "needs_review": 5,
    "findings_skipped": 1,
    "joern_available": true
  },
  "findings": [
    {
      "id": "VSCOUT-QA-001",
      "stable_key": "fixture:v1_2:js-sqli-confirmed",
      "kind": "finding",
      "severity": "critical",
      "type": "sql-injection",
      "title": "SQL injection in login handler",
      "file": "tests/fixtures/code/js/vulnerable-sqli/app.ts",
      "line": 6,
      "rule_id": "semgrep.js.sqli",
      "cwe": "CWE-89",
      "verdict": "verified",
      "confidence": "verified",
      "source_tool": "semgrep",
      "message": "User-controlled email is interpolated directly into a SQL query.",
      "remediation": "Use parameterized queries for all user-controlled values.",
      "in_diff": true,
      "dynamic_verified": true,
      "verification_level": 4,
      "cvss_vector": "CVSS:3.1/AV:N/AC:L/PR:N/UI:N/S:U/C:H/I:H/A:N",
      "cvss_score": 9.1,
      "chain_id": "chain-account-takeover",
      "chain_role": "entry",
      "evidence": [
        {
          "type": "code",
          "label": "tainted query",
          "path": "tests/fixtures/code/js/vulnerable-sqli/app.ts",
          "line": 6,
          "excerpt": "const sql = `SELECT * FROM users WHERE email = '${email}'`;",
          "role": "sink",
          "order": 1
        },
        {
          "type": "poc",
          "label": "executed payload",
          "path": "tests/fixtures/code/js/vulnerable-sqli/app.ts",
          "line": 6,
          "excerpt": "' OR '1'='1",
          "role": "source",
          "order": 0
        }
      ],
      "trust_metadata": {
        "provenance": {
          "origin": "dynamic_verified",
          "tool": "kuzushi",
          "contributors": ["deterministic_tool", "dynamic_verified"]
        },
        "exploitability_status": "confirmed",
        "false_positive_risk": {
          "level": "low",
          "reason": "Exploit payload was executed against the vulnerable query."
        },
        "confidence_reason": "Runtime confirmation showed attacker-controlled SQL changed query behavior."
      }
    },
    {
      "id": "VSCOUT-QA-002",
      "stable_key": "fixture:v1_2:go-ssrf-plausible",
      "kind": "finding",
      "severity": "high",
      "type": "ssrf",
      "title": "Go HTTP client fetches user-controlled URL",
      "file": "tests/fixtures/code/go/vulnerable-ssrf/main.go",
      "line": 19,
      "rule_id": "joern.go.ssrf",
      "cwe": "CWE-918",
      "verdict": "needs_review",
      "confidence": "high",
      "source_tool": "joern",
      "message": "User-controlled target reaches http.Get without host allowlisting.",
      "in_diff": true,
      "verification_level": 1,
      "cvss_vector": "CVSS:3.1/AV:N/AC:L/PR:N/UI:N/S:C/C:H/I:N/A:N",
      "cvss_score": 9.3,
      "chain_id": "chain-metadata-ssrf",
      "chain_role": "sink",
      "evidence": [
        {
          "type": "code",
          "label": "unsafe fetch",
          "path": "tests/fixtures/code/go/vulnerable-ssrf/main.go",
          "line": 19,
          "excerpt": "resp, err := http.Get(target)",
          "role": "sink",
          "order": 1
        }
      ],
      "trust_metadata": {
        "provenance": {
          "origin": "deterministic_tool",
          "tool": "joern",
          "contributors": ["deterministic_tool"]
        },
        "exploitability_status": "plausible",
        "false_positive_risk": {
          "level": "medium",
          "reason": "Dataflow is present but network egress controls were not checked."
        },
        "confidence_reason": "CPG dataflow connects request input to an outbound HTTP sink."
      }
    },
    {
      "id": "VSCOUT-QA-003",
      "stable_key": "fixture:v1_2:python-ssrf-auth",
      "kind": "finding",
      "severity": "high",
      "type": "ssrf",
      "title": "Authenticated image proxy can fetch internal hosts",
      "file": "tests/fixtures/code/python/vulnerable-ssrf/app.py",
      "line": 8,
      "rule_id": "full-audit.python.ssrf",
      "cwe": "CWE-918",
      "verdict": "needs_review",
      "confidence": "medium",
      "source_tool": "full-audit",
      "message": "The image proxy accepts arbitrary URLs after user login.",
      "in_diff": false,
      "verification_level": 2,
      "cvss_vector": "CVSS:3.1/AV:N/AC:L/PR:L/UI:N/S:C/C:H/I:N/A:N",
      "cvss_score": 8.5,
      "evidence": [
        {
          "type": "code",
          "label": "proxy fetch",
          "path": "tests/fixtures/code/python/vulnerable-ssrf/app.py",
          "line": 8,
          "excerpt": "return requests.get(url).text",
          "role": "sink",
          "order": 1
        }
      ],
      "claude_analysis": {
        "verdict": "verified",
        "confidence": "medium",
        "reasoning": "Authenticated users can supply the URL, but exploitation requires a valid session.",
        "exploitable": null
      },
      "trust_metadata": {
        "provenance": {
          "origin": "llm_analysis",
          "tool": "claude",
          "contributors": ["deterministic_tool", "llm_analysis"]
        },
        "exploitability_status": "requires_auth",
        "false_positive_risk": {
          "level": "medium",
          "reason": "Authentication requirement reduces reachability but not impact."
        },
        "confidence_reason": "Semantic review confirmed user influence after authentication."
      }
    },
    {
      "id": "VSCOUT-QA-004",
      "stable_key": "fixture:v1_2:php-sqli-blocked",
      "kind": "finding",
      "severity": "medium",
      "type": "sql-injection",
      "title": "SQL injection candidate blocked by prepared statement",
      "file": "tests/fixtures/code/php/safe-sqli/index.php",
      "line": 5,
      "rule_id": "semgrep.php.sqli",
      "cwe": "CWE-89",
      "verdict": "false_positive",
      "confidence": "low",
      "source_tool": "semgrep",
      "message": "A taint pattern matched near a prepared statement and was retained for reporting QA.",
      "fp_indicator": "prepared statement control prevents interpolation",
      "in_diff": false,
      "verification_level": 0,
      "evidence": [
        {
          "type": "code",
          "label": "prepared statement",
          "path": "tests/fixtures/code/php/safe-sqli/index.php",
          "line": 5,
          "excerpt": "$stmt = $db->prepare('SELECT * FROM users WHERE id = ?');",
          "role": "control",
          "order": 1
        }
      ],
      "trust_metadata": {
        "provenance": {
          "origin": "human_review",
          "tool": "review-ledger",
          "contributors": ["deterministic_tool", "human_review"]
        },
        "exploitability_status": "blocked_by_control",
        "false_positive_risk": {
          "level": "high",
          "reason": "A prepared statement blocks the matched dataflow."
        },
        "confidence_reason": "Manual review retained the case to exercise false-positive reporting."
      }
    },
    {
      "id": "VSCOUT-QA-005",
      "stable_key": "fixture:v1_2:java-cmdi-unreachable",
      "kind": "finding",
      "severity": "medium",
      "type": "command-injection",
      "title": "Command execution path is unreachable in production profile",
      "file": "tests/fixtures/code/java/safe-cmdi/App.java",
      "line": 12,
      "rule_id": "semgrep.java.cmdi",
      "cwe": "CWE-78",
      "verdict": "false_positive",
      "confidence": "medium",
      "source_tool": "semgrep",
      "message": "The command sink is guarded by a disabled development flag.",
      "fp_indicator": "unreachable production branch",
      "in_diff": false,
      "verification_level": 0,
      "evidence": [
        {
          "type": "code",
          "label": "disabled branch",
          "path": "tests/fixtures/code/java/safe-cmdi/App.java",
          "line": 12,
          "excerpt": "if (devMode) Runtime.getRuntime().exec(input);",
          "role": "control",
          "order": 1
        }
      ],
      "trust_metadata": {
        "provenance": {
          "origin": "mixed",
          "tool": "claude",
          "contributors": ["deterministic_tool", "llm_analysis", "human_review"]
        },
        "exploitability_status": "unreachable",
        "false_positive_risk": {
          "level": "high",
          "reason": "The sink is behind a disabled profile gate."
        },
        "confidence_reason": "Review combined pattern output and profile analysis."
      }
    },
    {
      "id": "VSCOUT-QA-006",
      "stable_key": "fixture:v1_2:ruby-secret-unknown",
      "kind": "finding",
      "severity": "low",
      "type": "hardcoded-secret",
      "title": "Potential placeholder API token",
      "file": "tests/fixtures/code/ruby/unsupported.rb",
      "line": 2,
      "rule_id": "semgrep.generic.secret",
      "cwe": "CWE-798",
      "verdict": "needs_review",
      "confidence": "low",
      "source_tool": "semgrep",
      "message": "A token-like literal was found in a fixture file.",
      "in_diff": false,
      "verification_level": 0,
      "evidence": [
        {
          "type": "code",
          "label": "token literal",
          "path": "tests/fixtures/code/ruby/unsupported.rb",
          "line": 2,
          "excerpt": "TOKEN = 'example-token'",
          "role": "sink",
          "order": 1
        }
      ],
      "trust_metadata": {
        "provenance": {
          "origin": "deterministic_tool",
          "tool": "semgrep",